{
  "id": "task-01",
  "description": "Complete vanilla JS calculator with session history",
  "intent": "Build a complete calculator as a single-page web app: HTML layout, CSS styling, JS arithmetic engine with operator precedence, button-driven UI, and a session history panel. Each teammate builds their own version independently on their own branch. Best overall implementation wins.",
  "mode": "compete",
  "status": "submitted",
  "notes": "Each person builds in trial-calculator/ on their own branch (feat/task-01-a, feat/task-01-b, feat/task-01-c). Target files: index.html, css/styles.css, js/calculator.js, js/ui.js, js/history.js",
  "acceptance_checks": [
    "Basic arithmetic works: 2+3=5, 2+3*4=14 (operator precedence), (2+3)*4=20 (parentheses)",
    "Handles edge cases: -5+3=-2 (unary minus), 10/3 returns decimal, 1/0 doesn't crash",
    "Calculator is centered and looks intentional on a typical laptop screen (>=1280px wide)",
    "Buttons have visible hover and active states",
    "Display has clear visual separation from the button grid",
    "Clicking buttons updates the display; pressing = evaluates and shows the result",
    "A Clear button resets the display",
    "Each evaluation appends to a visible history panel (expression + result, in-memory only)",
    "Invalid expressions (e.g. 2++3) show an error without crashing the page",
    "Opens in a browser by double-clicking index.html, no local server needed (no ES modules, no fetch calls)"
  ],
  "arbitration": {
    "method": "human_review",
    "criteria": [
      "correctness",
      "design_quality",
      "usability"
    ],
    "weights": {
      "correctness": 0.4,
      "design_quality": 0.35,
      "usability": 0.25
    }
  },
  "submissions": [
    {
      "author": "person_a",
      "branch": "feat/task-01-a",
      "status": "submitted",
      "notes": null,
      "commit_sha": "7e09a0f654b63c0bd87f1c670222ac0dd6f9ca5e",
      "test_command": "manual browser test",
      "test_result": "pass",
      "benchmark_command": null,
      "benchmark_result": null
    },
    {
      "author": "person_c",
      "branch": "feat/task-01-c",
      "status": "submitted",
      "notes": "Vanilla JS calculator with parser-based evaluation, session history, and polished local-file UI.",
      "commit_sha": "08eb1c613d3a52b0f398b368f1952f3ab9679bdf",
      "test_command": "node calculator engine smoke checks",
      "test_result": "pass",
      "benchmark_command": null,
      "benchmark_result": null
    }
  ],
  "winner": null,
  "winner_selected_by": null,
  "comparison_notes": null
}
