{
  "id": "task-03",
  "description": "Calculator HTML layout, UI glue, and session history",
  "intent": "Build the HTML layout and JavaScript glue that connects the calculator engine to the DOM. Clicking buttons should update the display, pressing = should evaluate via calculator.js, and each evaluation should append to a visible history panel.",
  "mode": "collab",
  "status": "not_started",
  "assigned_to": null,
  "branch": null,
  "notes": "Target files: trial-calculator/index.html, trial-calculator/js/ui.js, trial-calculator/js/history.js",
  "acceptance_checks": [
    "Clicking digit and operator buttons updates the display in real time",
    "Pressing = evaluates the current expression and shows the result",
    "A Clear button resets the display to empty",
    "Each completed evaluation appears in the history panel (expression and result)",
    "History is in-memory only (clears on page refresh, no localStorage)"
  ]
}
